{
    "schema_version":  "1.0",
    "suite_id":  "strict-suite-fixture",
    "suite_status":  "COMPLETED",
    "abort_reason":  null,
    "environment":  {
                        "host":  "DetFuzz-Win11-Lab",
                        "rule_id":  "d4f8c4e4-984d-4f5f-9f6c-1cc6b37f2f62",
                        "rule_slug":  "detfuzz-v0-powershell-encoded-command",
                        "telemetry":  "Microsoft-Windows-Sysmon/Operational"
                    },
    "cases":  [
                  {
                      "case_id":  "B0",
                      "classification":  "DETECTED",
                      "marker_valid":  true,
                      "telemetry_valid":  true,
                      "executable_identity_valid":  true,
                      "detection_matched":  true,
                      "rule_id":  "d4f8c4e4-984d-4f5f-9f6c-1cc6b37f2f62",
                      "rule_slug":  "detfuzz-v0-powershell-encoded-command"
                  },
                  {
                      "case_id":  "M1",
                      "classification":  "VALID_BYPASS",
                      "marker_valid":  true,
                      "telemetry_valid":  true,
                      "executable_identity_valid":  true,
                      "detection_matched":  false,
                      "rule_id":  "d4f8c4e4-984d-4f5f-9f6c-1cc6b37f2f62",
                      "rule_slug":  "detfuzz-v0-powershell-encoded-command"
                  },
                  {
                      "case_id":  "M2",
                      "classification":  "DETECTED",
                      "marker_valid":  true,
                      "telemetry_valid":  true,
                      "executable_identity_valid":  true,
                      "detection_matched":  true,
                      "rule_id":  "d4f8c4e4-984d-4f5f-9f6c-1cc6b37f2f62",
                      "rule_slug":  "detfuzz-v0-powershell-encoded-command"
                  },
                  {
                      "case_id":  "M3",
                      "classification":  "DETECTED",
                      "marker_valid":  true,
                      "telemetry_valid":  true,
                      "executable_identity_valid":  true,
                      "detection_matched":  true,
                      "rule_id":  "d4f8c4e4-984d-4f5f-9f6c-1cc6b37f2f62",
                      "rule_slug":  "detfuzz-v0-powershell-encoded-command"
                  },
                  {
                      "case_id":  "M4",
                      "classification":  "DETECTED",
                      "marker_valid":  true,
                      "telemetry_valid":  true,
                      "executable_identity_valid":  true,
                      "detection_matched":  true,
                      "rule_id":  "d4f8c4e4-984d-4f5f-9f6c-1cc6b37f2f62",
                      "rule_slug":  "detfuzz-v0-powershell-encoded-command"
                  },
                  {
                      "case_id":  "M5",
                      "classification":  "DETECTED",
                      "marker_valid":  true,
                      "telemetry_valid":  true,
                      "executable_identity_valid":  true,
                      "detection_matched":  true,
                      "rule_id":  "d4f8c4e4-984d-4f5f-9f6c-1cc6b37f2f62",
                      "rule_slug":  "detfuzz-v0-powershell-encoded-command"
                  },
                  {
                      "case_id":  "NC1",
                      "classification":  "INVALID_MUTANT",
                      "marker_valid":  true,
                      "telemetry_valid":  true,
                      "executable_identity_valid":  true,
                      "detection_matched":  false,
                      "rule_id":  "d4f8c4e4-984d-4f5f-9f6c-1cc6b37f2f62",
                      "rule_slug":  "detfuzz-v0-powershell-encoded-command"
                  },
                  {
                      "case_id":  "B1",
                      "classification":  "DETECTED",
                      "marker_valid":  true,
                      "telemetry_valid":  true,
                      "executable_identity_valid":  true,
                      "detection_matched":  true,
                      "rule_id":  "d4f8c4e4-984d-4f5f-9f6c-1cc6b37f2f62",
                      "rule_slug":  "detfuzz-v0-powershell-encoded-command"
                  }
              ],
    "evidence_manifest":  {
                              "root":  "tests/fixtures/evidence",
                              "files":  [
                                            {
                                                "path":  "B0/case-record.json",
                                                "sha256":  "0c05406eb14d5edfbdc7b6a684848602edecc3476a01e7057d732573b1c26166",
                                                "size_bytes":  317
                                            },
                                            {
                                                "path":  "B0/detection-result.json",
                                                "sha256":  "19f8d37b4405467a0e006a6c8529d5a6ee51309ae33f3a0c564fc1506ac500d2",
                                                "size_bytes":  180
                                            },
                                            {
                                                "path":  "B0/effect.json",
                                                "sha256":  "dae91dc1a4938f5ced5886b9706cbad81e7cf567f8e1b6ab2d7ce937555ce1a4",
                                                "size_bytes":  60
                                            },
                                            {
                                                "path":  "B0/executable-identity.json",
                                                "sha256":  "4cde9523fabdb6c134a0dfc60762890e74f38138cb9fc8b7503c397932de8dd0",
                                                "size_bytes":  177
                                            },
                                            {
                                                "path":  "B0/execution.json",
                                                "sha256":  "77d315c6e0cf4c0fa20f0a39fe3c6033fcdd9f13650c45f9013439c94377770e",
                                                "size_bytes":  98
                                            },
                                            {
                                                "path":  "B0/marker-validation.json",
                                                "sha256":  "7a8f58be94c94ea231ca1e13e8e7f51d2b1e0de5b6bd0e637154c9cf155fc977",
                                                "size_bytes":  83
                                            },
                                            {
                                                "path":  "B0/matched-sysmon-event.xml",
                                                "sha256":  "5f5ae505e108b4305d5fe8516e475cde4cbb2289e9c540ac44900902c7a4d8a6",
                                                "size_bytes":  133
                                            },
                                            {
                                                "path":  "B0/telemetry-validation.json",
                                                "sha256":  "3f8c670a40d596821c8c1bf0fa5a1e0553d037a0699d98dad6e108e907a095c2",
                                                "size_bytes":  235
                                            },
                                            {
                                                "path":  "B1/case-record.json",
                                                "sha256":  "0b740597a6a2be5aece933831ba3ee22c9a9c716207e9b7d296fe078e6399a2f",
                                                "size_bytes":  317
                                            },
                                            {
                                                "path":  "B1/detection-result.json",
                                                "sha256":  "19f8d37b4405467a0e006a6c8529d5a6ee51309ae33f3a0c564fc1506ac500d2",
                                                "size_bytes":  180
                                            },
                                            {
                                                "path":  "B1/effect.json",
                                                "sha256":  "bccc013324f9dadf319194d1984321ce3dfe5c1cd13b5b18055d778f8a975dc4",
                                                "size_bytes":  60
                                            },
                                            {
                                                "path":  "B1/executable-identity.json",
                                                "sha256":  "4cde9523fabdb6c134a0dfc60762890e74f38138cb9fc8b7503c397932de8dd0",
                                                "size_bytes":  177
                                            },
                                            {
                                                "path":  "B1/execution.json",
                                                "sha256":  "f419674c7d5d8d0ed373d05b250c0f635518353854c1845570a00e3429c2ab53",
                                                "size_bytes":  98
                                            },
                                            {
                                                "path":  "B1/marker-validation.json",
                                                "sha256":  "7a8f58be94c94ea231ca1e13e8e7f51d2b1e0de5b6bd0e637154c9cf155fc977",
                                                "size_bytes":  83
                                            },
                                            {
                                                "path":  "B1/matched-sysmon-event.xml",
                                                "sha256":  "666d9ae6e31b38ea19ec7f0df55a85a3631038c3d3f4124d2b67204eda89c4a6",